{
  "empresa": "Soufit",
  "codigo_pop": "POP-CRM-001",
  "area": "CRM / E-mail Marketing",
  "area_curta": "CRM",
  "estabelecido_em": "24/05/2026",
  "revisado_em": "",
  "nome_tarefa": "Estruturar fluxos de e-mail e jornada do cliente",
  "responsavel": "Responsável de CRM",
  "revisao": "primeira",
  "objetivo": "Garantir que os fluxos de e-mail sejam estruturados com racional de jornada do cliente, combinando ofertas, conteúdo de valor, timing adequado e próximos passos claros para cada nível de consciência",
  "material_necessario": [
    {"item": "Transcrição do treinamento de CRM", "quantidade": "1", "observacao": "Fonte principal para as diretrizes do POP"},
    {"item": "Mapa de produtos, iscas e ofertas ativas", "quantidade": "1", "observacao": "Incluir Fit Moderno, iscas em operação, ofertas, cupons, bônus e produtos complementares"},
    {"item": "Histórico de fluxos existentes", "quantidade": "1", "observacao": "Fluxos atuais de abandono de carrinho, pós-compra, iscas e newsletter"},
    {"item": "Banco de argumentos", "quantidade": "1", "observacao": "Benefícios, dores, depoimentos, estudos de caso, pesquisas científicas, garantia, Anvisa, receitas e dicas de rotina"},
    {"item": "Ferramenta de automação de e-mail/CRM", "quantidade": "1", "observacao": "Usar para configurar delays, janelas de envio, segmentações, testes A/B e status dos fluxos"},
    {"item": "Brief para copy e design", "quantidade": "1 por e-mail", "observacao": "Informar objetivo do e-mail, oferta, argumento principal e CTA quando houver"}
  ],
  "passos_criticos": [
    "Definir qual fluxo será estruturado: abandono de carrinho, pós-compra, isca, newsletter ou outro fluxo de relacionamento",
    "Identificar o nível de consciência da pessoa no momento em que entra no fluxo. Quanto maior a consciência, menor pode ser a sequência; quanto mais fria a pessoa, maior deve ser a nutrição",
    "Responder antes de montar os e-mails: qual é o processo natural que essa pessoa deveria seguir agora e qual contexto faz mais sentido ela ver nos próximos passos?",
    "Levantar os recursos disponíveis para o fluxo: cupons, bônus, benefícios, dores resolvidas, depoimentos, estudos de caso, pesquisas científicas, garantias, Anvisa, receitas, dicas de rotina e ofertas complementares",
    "Evitar fluxos muito curtos. Usar normalmente no mínimo 4 a 5 e-mails; para abandono de carrinho, considerar 6 a 8 e-mails; para fluxos de isca, considerar 10 a 12 e-mails",
    "Para abandono de carrinho, criar o primeiro e-mail de 3 a 5 minutos após o abandono, com chamada direta para resolver dúvida, problema de pagamento ou retorno ao checkout/WhatsApp",
    "Criar o segundo e-mail de abandono entre 6, 12 ou 24 horas depois, com incentivo simples, como 5% de desconto, cupom Soufit05 ou bônus intermediário, sem usar uma oferta agressiva demais no início",
    "Configurar regras de horário e intervalo para impedir envios em horários ruins, como madrugada. Não usar apenas 24 horas cravadas se isso puder disparar e-mail em horário inadequado",
    "Criar o terceiro e-mail com oferta um pouco mais agressiva, como 10% de desconto, combinada com reforço de benefícios, prova social ou estudo de caso",
    "Depois de dois ou três e-mails de oferta, inserir um ou dois e-mails de quebra com valor real, como dica, receita, pesquisa científica, estudo de caso ou conteúdo educativo sem CTA direto",
    "Retomar ofertas finais no abandono de carrinho somente depois das quebras de valor, usando argumentos diferentes ou ofertas progressivas quando houver recursos, como bônus, desconto maior ou mecânica compre dois e ganhe três",
    "Se a pessoa não converter no fluxo de abandono, direcionar para um próximo fluxo de nutrição, como newsletter, em vez de insistir indefinidamente na mesma oferta",
    "Para pós-compra, enviar uma comunicação imediata de parabéns e avaliar uma oferta de aumento de ticket nas primeiras 24 horas, como comprar mais uma unidade e ganhar outra, quando aplicável",
    "No fluxo de pós-compra, evitar vender novamente o mesmo produto logo após a compra. Nutrir com conteúdo, outros produtos e relacionamento até se aproximar da janela de recompra",
    "Para produtos com ciclo de uso de 30 dias, como Fit Moderno com 30 cápsulas, iniciar ofertas de recompra por volta do 20º ao 25º dia",
    "No pós-compra, preferir frequência de um e-mail a cada dois ou três dias quando o relacionamento precisar ser trabalhado. Evitar depender apenas de um e-mail por semana",
    "Para newsletter, reunir artigos científicos, benefícios, novidades de mercado, receitas, dicas e argumentos relacionados ao produto, mantendo foco em valor e relacionamento",
    "A cada três newsletters sem CTA direto, avaliar incluir um e-mail conduzindo para produto, isca ou outro fluxo relacionado",
    "Montar o esqueleto do fluxo antes da copy final, descrevendo para cada e-mail o objetivo, o argumento central, a oferta ou conteúdo de valor e o CTA quando houver",
    "Enviar para copy e design somente depois que o racional do fluxo estiver claro, evitando retrabalho por quebra na etapa inicial",
    "Para o copywriter, informar o objetivo do e-mail de forma objetiva, por exemplo: e-mail três com cupom de 10% mais reforço de benefícios. Não é necessário entregar título final se esse não for o papel do CRM",
    "Permitir reformulação e teste A/B dos fluxos quando houver dúvida entre caminhos válidos, mantendo o fundamento da jornada como critério de decisão",
    "Revisar os fluxos existentes de pós-compra e abandono de carrinho aplicando as novas diretrizes de tamanho, timing, equilíbrio entre oferta e valor e racional de jornada",
    "Centralizar as diretrizes e esqueletos criados em um local de consulta para que a equipe possa reutilizar o padrão"
  ],
  "manuseio_material": [
    "Salvar a transcrição, o POP e os esqueletos de fluxo em uma pasta centralizada de CRM ou banco de treinamentos",
    "Manter versão atualizada dos fluxos existentes antes de reformular qualquer automação ativa",
    "Nomear cada fluxo com tipo, produto/isca e data de criação ou revisão",
    "Registrar decisões de teste A/B, janelas de envio, cupons e critérios de exclusão ou passagem para outro fluxo",
    "Solicitar apoio quando houver ferramenta, produto ou etapa operacional que a pessoa responsável não domine"
  ],
  "resultados_esperados": [
    "Cada fluxo possui um racional claro baseado no próximo passo natural do cliente",
    "Fluxos de isca possuem aproximadamente 10 a 12 e-mails quando o público estiver frio ou com baixa consciência",
    "Fluxos de abandono de carrinho possuem sequência equilibrada entre contato rápido, incentivo, prova social, conteúdo de valor e ofertas finais",
    "E-mails não são disparados em horários inadequados por falta de regra de horário ou gap",
    "A sequência alterna oferta e valor, evitando CTA e promoção em todos os e-mails",
    "Copy e design recebem briefs objetivos, reduzindo retrabalho",
    "Fluxos de pós-compra trabalham relacionamento, ticket médio e recompra dentro da janela correta do produto",
    "Diretrizes ficam centralizadas para consulta futura e treinamento da equipe"
  ],
  "acoes_corretivas": [
    "Se o fluxo estiver curto demais, expandir a sequência com e-mails de valor, prova social, estudos de caso, pesquisas, receitas ou argumentos de benefício",
    "Se houver excesso de ofertas consecutivas, inserir um ou dois e-mails de quebra no CTA direto antes de retomar a venda",
    "Se os disparos ocorrerem em horários ruins, ajustar janelas de entrega e gaps na ferramenta de CRM",
    "Se o copywriter ou designer gerar material desalinhado, revisar o brief do e-mail e explicitar objetivo, oferta, argumento principal e CTA",
    "Se a taxa de resposta/conversão estiver baixa, propor teste A/B de oferta, argumento, timing ou CTA, mantendo o racional da jornada",
    "Se a equipe não souber operar uma ferramenta ou etapa, acionar o responsável pelo treinamento e registrar a necessidade no banco de treinamentos",
    "Se o fluxo de abandono não converter após as ofertas finais, mover o contato para newsletter ou outro fluxo de nutrição em vez de insistir na mesma campanha",
    "Se o fluxo de pós-compra estiver vendendo o mesmo produto cedo demais, substituir por conteúdo, cross-sell ou relacionamento até a janela de recompra"
  ],
  "fontes": "Transcrição enviada pelo usuário: Treinamento de CRM — Estruturação de Fluxos de E-mail e Jornada do Cliente"
}
